user_input,output,flag,username,timestamp
25 yaşında bir kadınım. bana hangicheckup üzerinden hangi check up paketini önerirsin?,"Hangicheckup, farklı yaş gruplarına ve cinsiyete özel olarak çeşitli check-up paketleri sunmaktadır. Ancak, belirli bir check-up paketi önermeden önce, genel sağlık durumunuz ve risk faktörleriniz gibi kişisel faktörlerinizi göz önünde bulundurmanız önemlidir.

Yaşınız itibariyle, genel sağlığınızı değerlendirmek için aşağıdaki check-up paketlerini düşünebilirsiniz:

1. Genel Check-up: Bu paket, kan testleri, idrar testleri, karaciğer ve böbrek fonksiyon testleri, tiroit değerlendirme ve temel sağlık taraması gibi genel sağlık durumunuzu değerlendirmek için yapılan temel testleri içerir.

2. Kadın Sağlığı Check-up: Bu paket, jinekolojik muayene, meme ultrasonu, smear testi (PAP smear), meme kanseri taraması ve yumurtalık kanseri taraması gibi kadın sağlığına özgü testleri içerir.

3. Kardiyovasküler Check-up: Bu paket, kolesterol testi, EKG (elektrokardiyografi), ekokardiyografi ve kalp damar sağlığına yönelik diğer testleri içerir. Bu paket, kalp hastalığı riskine sahip olabilecek kişiler için önerilir.

4. Kanser Tarama Check-up: Bu paket, meme kanseri taraması, kolorektal kanser taraması (kolonoskopi), akciğer kanseri taraması ve prostat kanseri taraması (prostat spesifik antigen testi) gibi kanser tarama testlerini içerir. Bu paket, kanser riskinizi belirlemek ve erken teşhis etmek için önerilir.

Seçtiğiniz check-up paketi, genel sağlık durumunuza, aile öyküsüne ve doktorunuzun önerilerine bağlı olarak değişebilir. Bu nedenle, check-up paketi seçerken bir uzmana danışmanız önemlidir.",,,2023-12-22 12:25:15.035124
